{
  "$schema": "../../../spec/schemas/component.schema.json",
  "schema": "neosmartuxui/component@1",
  "id": "core.description-list",
  "layer": "component",
  "domain": "core",
  "intent": "Present authored term-and-description relationships with native description-list semantics while preserving one-to-many and many-to-one term/description groupings, descendant-control behavior, and passive document structure without acquiring collection ordering, selection, composite navigation, disclosure, editing, persistence, network, form, or business authority.",
  "states": [
    "rest"
  ],
  "dependencies": [
    "color.content.primary",
    "color.content.secondary",
    "color.border.default",
    "space.surface.inline",
    "space.surface.block",
    "border.surface.width",
    "font.family.body",
    "font.size.body",
    "font.weight.regular",
    "font.weight.strong"
  ],
  "supports": {
    "keyboard": true,
    "touch": true,
    "rtl": true,
    "reducedMotion": true,
    "forcedColors": true
  }
}
